{
	"info": {
		"_postman_id": "49919794-bf848f85-cc0c-49f7-902d-b2aed38af7cf",
		"name": "Recipe_Assessment",
		"schema": "https://schema.getpostman.com/json/collection/v2.1.0/collection.json"
	},
	"item": [
		{
			"name": "search-calorie",
			"id": "49919794-24c5e6d0-22a9-4959-a6aa-a6add0b720f1",
			"protocolProfileBehavior": {
				"disableBodyPruning": true
			},
			"request": {
				"method": "GET",
				"header": [],
				"url": {
					"raw": "http://127.0.0.1:8000/recipes/search?calorie=<300\n",
					"protocol": "http",
					"host": [
						"127",
						"0",
						"0",
						"1"
					],
					"port": "8000",
					"path": [
						"recipes",
						"search"
					],
					"query": [
						{
							"key": "calorie",
							"value": "<300\n"
						}
					]
				},
				"description": "### Search recipes by calorie\n\nUse this endpoint to retrieve paginated recipes filtered by their calorie content. The response includes basic recipe metadata (title, cuisine, rating, times) and a nutrients field with calories and other nutrition info.\n\n- Method: `GET`\n    \n- URL: `http://127.0.0.1:8000/recipes/search`\n    \n\n#### Query parameters\n\n- `calorie` (string, optional): Filter by calorie value using comparison operators. Supported examples observed in this workspace: `<300`, `>80`, `=80`.\n    \n- as **rating** is not specified,items are sorted in descending order by default\n    \n\nNote: Operators are placed directly before the number or value (e.g., `?calorie=<300`).\n\n#### Pagination\n\nThe response contains:\n\n- `page`: current page number\n    \n- `limit`: items per page\n    \n- `total_results`: total matching items\n    \n- `total_pages`: number of pages\n    \n- `results`: array of recipe objects\n    \n\n#### Example requests\n\n- Filter recipes under 300 kcal: `GET /recipes/search?calorie=<300`\n    \n- Filter recipes over 80 kcal: `GET /recipes/search?calorie=>80`\n    \n\n#### Sample response (truncated)\n\n``` json\n{\n  \"page\": 1,\n  \"limit\": 10,\n  \"total_results\": 4443,\n  \"total_pages\": 445,\n  \"results\": [\n    {\n      \"cuisine\": \"Hanukkah Kugel\",\n      \"title\": \"Harvest Noodle Pudding - Fruit Kugel\",\n      \"rating\": 5,\n      \"id\": 7890,\n      \"prep_time\": 15,\n      \"cook_time\": 45,\n      \"total_time\": 120,\n      \"nutrients\": \"{\\\"calories\\\": \\\"228 kcal\\\", ... }\"\n    },\n    {\n      \"cuisine\": \"Tex-Mex Recipes\",\n      \"title\": \"Authentic Fire-Roasted Tex-Mex Salsa\",\n      \"rating\": 5,\n      \"id\": 8295,\n      \"total_time\": 20,\n      \"nutrients\": \"{\\\"calories\\\": \\\"14 kcal\\\" ... }\"\n    }\n  ]\n}\n\n ```\n\n#### Related requests in this collection\n\n- search by rating\n    \n- search-total_time\n    \n- search-calorie (this request)\n    \n- search by title\n    \n- search by cuisine\n    \n\nThese related requests illustrate additional parameters and accepted operator formats used across this API."
			},
			"response": []
		},
		{
			"name": "search-total_time",
			"id": "49919794-a920d871-0ab1-4f90-aac6-3029a0428e65",
			"protocolProfileBehavior": {
				"disableBodyPruning": true
			},
			"request": {
				"method": "GET",
				"header": [],
				"url": {
					"raw": "http://127.0.0.1:8000/recipes/search?total_time=>1900\n",
					"protocol": "http",
					"host": [
						"127",
						"0",
						"0",
						"1"
					],
					"port": "8000",
					"path": [
						"recipes",
						"search"
					],
					"query": [
						{
							"key": "total_time",
							"value": ">1900\n"
						}
					]
				},
				"description": "## Search recipes by total_time\n\nUse this endpoint to filter recipes by total preparation time.\n\n- Method: GET\n    \n- URL: `http://127.0.0.1:8000/recipes/search`\n    \n- Query parameter: `total_time` accepts comparison operators followed by a number of minutes.\n    \n\n### Parameters\n\n- `total_time` (string, optional) — Filter by total minutes. Supported prefixes:\n    \n    - `>N` — recipes with total_time strictly greater than N minutes.\n        \n\n```\n- ``` `` `=N` — recipes with total_time exactly N minutes (if supported by your backend). `` ```\n\n ```\n\n`` `Examples:` ``\n\n- ``` `` `?total_time=>80` — recipes taking more than 80 minutes. `` ```\n    \n- ``` `` `?total_time=<80` — recipes taking less than 80 minutes. `` ```\n    \n- ``` `` `?total_time=>1900` — extreme filter useful for boundary testing. `` ```\n    \n\n### `` `Notes` ``\n\n- `` `200 OK with a JSON array of recipe objects on success.` ``\n    \n- `` `4xx for invalid operator or malformed value.` ``"
			},
			"response": []
		},
		{
			"name": "search-any parameter",
			"id": "49919794-f8ceed82-07ee-4516-8d49-d59a490ddfb4",
			"protocolProfileBehavior": {
				"disableBodyPruning": true
			},
			"request": {
				"method": "GET",
				"header": [],
				"url": {
					"raw": "http://127.0.0.1:8000/recipes/search\n",
					"protocol": "http",
					"host": [
						"127",
						"0",
						"0",
						"1"
					],
					"port": "8000",
					"path": [
						"recipes",
						"search\n"
					]
				},
				"description": "## Search recipes (any parameter)\n\nEndpoint  \nGET [http://127.0.0.1:8000/recipes/search](http://127.0.0.1:8000/recipes/search)\n\nPurpose  \nSearch the recipes by one or more query parameters. At least one search parameter is required; otherwise, the API returns 400.\n\nQuery parameters\n\n- title (string): partial, case-insensitive match on recipe title. Example: ?title=honey\n    \n- cuisine (string): filter by cuisine name. Example: ?cuisine=Southern\n    \n- rating (number with operator): supports operators >, =. Examples: ?rating=>3, ?rating==3\n    \n- calorie (number with operator): supports operators <, >, =. Examples: ?calorie=<300, ?calorie=>80, ?calorie==80\n    \n- total_time (number with operator, minutes): supports operators <, >. Examples: ?total_time=<80, ?total_time=>80\n    \n\nNotes on operators  \nProvide the comparator inline as a prefix (or equality as ==) to the numeric value, e.g., \"<300\", \">80\", or \"=80\". Multiple parameters can be combined: e.g., ?cuisine=Southern&calorie=<300&rating=>3.\n\nExamples\n\n- By title: /recipes/search?title=honey (see related request: search by title)\n    \n- By cuisine: /recipes/search?cuisine=Southern (see related request: search by cuisine)\n    \n- By rating: /recipes/search?rating=>3 (see related request: search by rating)\n    \n- By calories: /recipes/search?calorie=<300 (see related request: search-calorie)\n    \n- By total time: /recipes/search?total_time=<80 (see related request: search-total_time)\n    \n\nExpected responses\n\n- 200 OK: Array of recipe objects matching the filters.\n    \n- 400 Bad Request: Returned when no query parameters are provided. Example body: {  \n    \"detail\": \"At least one search parameter is required\"  \n    }\n    \n\nRelated requests in this collection\n\n- search by rating\n    \n- search-total_time\n    \n- search-calorie\n    \n- search by title\n    \n- search by cuisine\n    \n\nTesting hints\n\n- Add different combinations of parameters to validate intersection filtering.\n    \n- If you receive 400, ensure you are providing at least one of the documented parameters."
			},
			"response": []
		},
		{
			"name": "all recipes",
			"id": "49919794-6e8c9a47-e8a4-43c0-920b-cbd063ac7b19",
			"protocolProfileBehavior": {
				"disableBodyPruning": true
			},
			"request": {
				"method": "GET",
				"header": [],
				"url": {
					"raw": "http://127.0.0.1:8000/recipes",
					"protocol": "http",
					"host": [
						"127",
						"0",
						"0",
						"1"
					],
					"port": "8000",
					"path": [
						"recipes"
					]
				},
				"description": "Endpoint: GET /recipes  \nBase URL: [http://127.0.0.1:8000](http://127.0.0.1:8000)\n\nPurpose  \nFetch a paginated list of recipe summaries.\n\nQuery parameters\n\n- page (integer, optional): Page number to retrieve. Default: 1.\n    \n- limit (integer, optional): Number of items per page. Default: 10.\n    \n- rating (integer, optional): Filter recipes by rating (e.g., 5).\n    \n- cuisine (string, optional): Filter by cuisine/category name (e.g., \"Tex-Mex Recipes\").\n    \n- title (string, optional): Filter by recipe title (partial match allowed).\n    \n- total_time (integer, optional): Filter by total_time in minutes.\n    \n\nSuccessful response (200) example structure  \n{  \n\"page\": 1,  \n\"limit\": 10,  \n\"total\": 8451,  \n\"total_pages\": 846,  \n\"recipes\": \\[  \n{  \n\"cuisine\": \"Breakfast Potatoes\",  \n\"title\": \"Crispy (No-Fry) Potato Pancake Poppers\",  \n\"rating\": 5,  \n\"id\": 6036,  \n\"prep_time\": 20,  \n\"description\": \"...\",  \n\"serves\": \"6 servings\",  \n\"cook_time\": 40,  \n\"total_time\": 70,  \n\"nutrients\": \"{\"calories\": \"204 kcal\", \"fatContent\": \"...\"}\"  \n}  \n// ...more recipe items  \n\\]  \n}\n\nNotes\n\n- The nutrients field is a JSON string; parse if needed.\n    \n- Additional filters may be supported by the API; see other requests in this collection for examples."
			},
			"response": []
		},
		{
			"name": "search by rating",
			"id": "49919794-64592343-8e63-457b-b292-90743f56861e",
			"protocolProfileBehavior": {
				"disableBodyPruning": true
			},
			"request": {
				"method": "GET",
				"header": [],
				"url": {
					"raw": "http://127.0.0.1:8000/recipes/search?rating==3\n",
					"protocol": "http",
					"host": [
						"127",
						"0",
						"0",
						"1"
					],
					"port": "8000",
					"path": [
						"recipes",
						"search"
					],
					"query": [
						{
							"key": "rating",
							"value": "=3\n"
						}
					]
				}
			},
			"response": []
		},
		{
			"name": "search by cuisine",
			"id": "49919794-b72ad730-0528-4d0a-bcc3-0662e1ea6db1",
			"protocolProfileBehavior": {
				"disableBodyPruning": true
			},
			"request": {
				"method": "GET",
				"header": [],
				"url": {
					"raw": "http://127.0.0.1:8000/recipes/search?cuisine=Southern",
					"protocol": "http",
					"host": [
						"127",
						"0",
						"0",
						"1"
					],
					"port": "8000",
					"path": [
						"recipes",
						"search"
					],
					"query": [
						{
							"key": "cuisine",
							"value": "Southern"
						}
					]
				}
			},
			"response": []
		},
		{
			"name": "search by title",
			"id": "49919794-956234e5-a4c2-4a28-b8bc-11cbb947adef",
			"protocolProfileBehavior": {
				"disableBodyPruning": true
			},
			"request": {
				"method": "GET",
				"header": [],
				"url": {
					"raw": "http://127.0.0.1:8000/recipes/search?title=honey",
					"protocol": "http",
					"host": [
						"127",
						"0",
						"0",
						"1"
					],
					"port": "8000",
					"path": [
						"recipes",
						"search"
					],
					"query": [
						{
							"key": "title",
							"value": "honey"
						}
					]
				}
			},
			"response": []
		},
		{
			"name": "search by all",
			"id": "49919794-d0f694e8-2db5-464e-aa60-4291306c97a9",
			"protocolProfileBehavior": {
				"disableBodyPruning": true
			},
			"request": {
				"method": "GET",
				"header": [],
				"url": {
					"raw": "http://127.0.0.1:8000/recipes/search?title=honey&cuisine=Southern&rating=>3&total_time=<80&calorie=>80",
					"protocol": "http",
					"host": [
						"127",
						"0",
						"0",
						"1"
					],
					"port": "8000",
					"path": [
						"recipes",
						"search"
					],
					"query": [
						{
							"key": "title",
							"value": "honey"
						},
						{
							"key": "cuisine",
							"value": "Southern"
						},
						{
							"key": "rating",
							"value": ">3"
						},
						{
							"key": "total_time",
							"value": "<80"
						},
						{
							"key": "calorie",
							"value": ">80"
						}
					]
				}
			},
			"response": []
		},
		{
			"name": "New Request",
			"id": "49919794-c6b0b2db-1531-4543-9846-9a5b3337c8ab",
			"protocolProfileBehavior": {
				"disableBodyPruning": true
			},
			"request": {
				"method": "GET",
				"header": [],
				"description": "# Recipe Service – New Request\n\n## Overview\n\nThis request is part of the Recipe_Assessment collection and is intended to query the Recipe Service API. The URL/method will be defined in this request tab. This description documents how to use and extend this request without changing its behavior.\n\n## Usage\n\n- Ensure the appropriate environment is selected if this request uses variables like `{{baseUrl}}` or `{{apiKey}}`.\n    \n- Send the request to retrieve recipe data based on configured query parameters.\n    \n\n## Possible Query Parameters\n\n- `title`: Filter recipes by title text (e.g., \"pasta\").\n    \n- `cuisine`: Filter by cuisine type (e.g., \"italian\").\n    \n- `rating`: Minimum average rating (number).\n    \n- `calories`: Maximum calories (number).\n    \n- `total_time`: Maximum total cooking time in minutes (number).\n    \n\n## Headers\n\n- `Accept`: `application/json`\n    \n- `Content-Type`: `application/json` (if a body is later added)\n    \n- `Authorization`: `Bearer {{token}}` (if the API requires authentication)\n    \n\n## Authentication\n\nThis request may require a Bearer token. If so, set an environment variable `token` and configure Authorization to use Bearer Token with value `{{token}}`.\n\n## Responses\n\n- `200 OK`: Returns a JSON list of recipes. Typical shape:\n    \n    ``` json\n      {\n      \"data\": [\n        {\n          \"id\": \"123\",\n          \"title\": \"Example Recipe\",\n          \"cuisine\": \"italian\",\n          \"rating\": 4.6,\n          \"calories\": 520,\n          \"total_time\": 30\n        }\n      ],\n      \"count\": 1\n      }\n    \n     ```\n    \n- `400 Bad Request`: Invalid query parameters.\n    \n- `401 Unauthorized`: Missing or invalid authentication.\n    \n- `404 Not Found`: No recipes match the criteria.\n    \n\n## Tips\n\n- Use examples to document different response scenarios (200, 400, 404) once the API behavior is confirmed.\n    \n- Add test scripts to assert status code and response schema when you’re ready to automate.\n    \n\n## Change log\n\n- Initial documentation added by Agent Mode."
			},
			"response": []
		}
	]
}